name,price,url
LONG FAUX SHEARLING COAT,89.95 EUR,https://www.zara.com/de/en/long-faux-shearling-coat-p01255856.html
LONGLINE BELTED WOOL BLEND COAT,119.00 EUR,https://www.zara.com/de/en/longline-belted-wool-blend-coat-p09174141.html
LONG FAUX SHEARLING COAT,89.95 EUR,https://www.zara.com/de/en/long-faux-shearling-coat-p08372301.html
PADDED HOODED WINDBREAKER ANORAK,69.95 EUR,https://www.zara.com/de/en/padded-hooded-windbreaker-anorak-p03046225.html
FAUX FUR COAT,79.95 EUR,https://www.zara.com/de/en/faux-fur-coat-p01255770.html
LONG ANORAK WITH WATER AND WIND PROTECTION,99.95 EUR,https://www.zara.com/de/en/long-anorak-with-water-and-wind-protection-p04749741.html
KNITTED COAT WITH FAUX FUR COLLAR,89.95 EUR,https://www.zara.com/de/en/knitted-coat-with-faux-fur-collar-p04192123.html
FAUX FUR COAT,99.95 EUR,https://www.zara.com/de/en/faux-fur-coat-p06318242.html
SOFT HOODED BELTED COAT,49.95 EUR,https://www.zara.com/de/en/soft-hooded-belted-coat-p03046328.html
SHORT FAUX FUR COAT,69.95 EUR,https://www.zara.com/de/en/short-faux-fur-coat-p04341774.html
DOUBLE-FACED SEMI-LONG COAT,69.95 EUR,https://www.zara.com/de/en/double-faced-semi-long-coat-p06318252.html
ANIMAL PRINT FAUX FUR SHORT COAT,79.95 EUR,https://www.zara.com/de/en/animal-print-faux-fur-short-coat-p04341775.html
SOFT COAT,49.95 EUR,https://www.zara.com/de/en/soft-coat-p08073259.html
WOOL BLEND DOUBLE-BREASTED COAT,79.95 EUR,https://www.zara.com/de/en/wool-blend-double-breasted-coat-p09340141.html
TEXTURED LONG KNIT COAT,79.95 EUR,https://www.zara.com/de/en/textured-long-knit-coat-p03653110.html
COMBINED ANORAK ZW COLLECTION,99.95 EUR,https://www.zara.com/de/en/combined-anorak-zw-collection-p00155245.html
MANTECO WOOL BLEND COAT ZW COLLECTION,149.00 EUR,https://www.zara.com/de/en/manteco-wool-blend-coat-zw-collection-p09862638.html
SOFT OVERSIZE COAT,69.95 EUR,https://www.zara.com/de/en/soft-oversize-coat-p03046299.html
PADDED HOODED WINDPROOF ANORAK,69.95 EUR,https://www.zara.com/de/en/padded-hooded-windproof-anorak-p03046225.html
SOFT OVERSIZE COAT,69.95 EUR,https://www.zara.com/de/en/soft-oversize-coat-p03046299.html
FAUX FUR COAT,59.95 EUR,https://www.zara.com/de/en/faux-fur-coat-p06318246.html
SOFT OVERSIZE COAT,69.95 EUR,https://www.zara.com/de/en/soft-oversize-coat-p03046299.html
SHORT FAUX FUR COAT,69.95 EUR,https://www.zara.com/de/en/short-faux-fur-coat-p06318024.html
WOOL COAT WITH FAUX FUR LAPELS,119.00 EUR,https://www.zara.com/de/en/wool-coat-with-faux-fur-lapels-p09225147.html
PADDED HOODED WINDPROOF ANORAK,69.95 EUR,https://www.zara.com/de/en/padded-hooded-windproof-anorak-p03046225.html
PADDED HOODED WINDPROOF ANORAK,69.95 EUR,https://www.zara.com/de/en/padded-hooded-windproof-anorak-p03046225.html
KNIT COAT WITH PATCH POCKETS,69.95 EUR,https://www.zara.com/de/en/knit-coat-with-patch-pockets-p05755125.html
LONG FAUX SHEARLING COAT,89.95 EUR,https://www.zara.com/de/en/long-faux-shearling-coat-p01255856.html
WATER- AND WIND-RESISTANT ANORAK,89.95 EUR,https://www.zara.com/de/en/water--and-wind-resistant-anorak-p04749740.html
WOOL BLEND BELTED COAT,99.95 EUR,https://www.zara.com/de/en/wool-blend-belted-coat-p06318240.html
OVERSIZED COAT WITH WOOL,79.95 EUR,https://www.zara.com/de/en/oversized-coat-with-wool-p03046345.html
OVERSIZED COAT WITH WOOL,79.95 EUR,https://www.zara.com/de/en/oversized-coat-with-wool-p03046345.html
HOODED ANORAK WITH WATER AND WIND PROTECTION,69.95 EUR,https://www.zara.com/de/en/hooded-anorak-with-water-and-wind-protection-p08073224.html
WOOL COAT WITH FAUX FUR LAPELS,119.00 EUR,https://www.zara.com/de/en/wool-coat-with-faux-fur-lapels-p09225147.html
SHORT ANORAK WITH WATER AND WIND PROTECTION,59.95 EUR,https://www.zara.com/de/en/short-anorak-with-water-and-wind-protection-p04749703.html
BOUCLÉ COAT,69.95 EUR,https://www.zara.com/de/en/boucle-coat-p08073257.html
WOOL BLEND LONG COAT,119.00 EUR,https://www.zara.com/de/en/wool-blend-long-coat-p09731147.html
WOOL BLEND BELTED COAT,99.95 EUR,https://www.zara.com/de/en/wool-blend-belted-coat-p06318240.html
WOOL BLEND DOUBLE-BREASTED COAT,79.95 EUR,https://www.zara.com/de/en/wool-blend-double-breasted-coat-p09037141.html
FX FR CT 14,229.00 EUR,https://www.zara.com/de/en/fx-fr-ct-14-p03692956.html
WOOL BLEND DOUBLE-BREASTED COAT,89.95 EUR,https://www.zara.com/de/en/wool-blend-double-breasted-coat-p04070222.html
ANIMAL JACQUARD KNIT LONG COAT,149.00 EUR,https://www.zara.com/de/en/animal-jacquard-knit-long-coat-p02142183.html
BOUCLÉ DOUBLE-BREASTED COAT,59.95 EUR,https://www.zara.com/de/en/boucle-double-breasted-coat-p03046296.html
FAUX FUR SHORT COAT,79.95 EUR,https://www.zara.com/de/en/faux-fur-short-coat-p01255768.html
SHORT FAUX FUR COAT,79.95 EUR,https://www.zara.com/de/en/short-faux-fur-coat-p04369101.html
ZW COLLECTION FITTED MANTECO WOOL BLEND COAT,149.00 EUR,https://www.zara.com/de/en/zw-collection-fitted-manteco-wool-blend-coat-p09047632.html
LONG FAUX FUR COAT,89.95 EUR,https://www.zara.com/de/en/long-faux-fur-coat-p06318245.html
ZW COLLECTION WOOL BLEND COAT WITH BELT,119.00 EUR,https://www.zara.com/de/en/zw-collection-wool-blend-coat-with-belt-p08491244.html
BOUCLÉ DOUBLE-BREASTED COAT,59.95 EUR,https://www.zara.com/de/en/boucle-double-breasted-coat-p03046296.html
FAUX FUR COAT,69.95 EUR,https://www.zara.com/de/en/faux-fur-coat-p04391855.html
ZW COLLECTION DOUBLE-FACED JACKET,89.95 EUR,https://www.zara.com/de/en/zw-collection-double-faced-jacket-p03548246.html
FAUX FUR SHORT COAT ZW COLLECTION,119.00 EUR,https://www.zara.com/de/en/faux-fur-short-coat-zw-collection-p04369248.html
LONGLINE BELTED WOOL BLEND COAT,119.00 EUR,https://www.zara.com/de/en/longline-belted-wool-blend-coat-p09174141.html
STITCHED PADDED ANORAK,69.95 EUR,https://www.zara.com/de/en/stitched-padded-anorak-p06318229.html
ZW COLLECTION WOOL BLEND COAT,149.00 EUR,https://www.zara.com/de/en/zw-collection-wool-blend-coat-p09231745.html
BELTED FAUX FUR COAT ZW COLLECTION,149.00 EUR,https://www.zara.com/de/en/belted-faux-fur-coat-zw-collection-p04360249.html
FAUX FUR LAPEL COAT,69.95 EUR,https://www.zara.com/de/en/faux-fur-lapel-coat-p03046353.html
LONGLINE DOUBLE-BREASTED WOOL BLEND COAT,119.00 EUR,https://www.zara.com/de/en/longline-double-breasted-wool-blend-coat-p04070221.html
LONGLINE BELTED WOOL BLEND COAT,119.00 EUR,https://www.zara.com/de/en/longline-belted-wool-blend-coat-p09174141.html
LONG ANORAK WITH HOOD,79.95 EUR,https://www.zara.com/de/en/long-anorak-with-hood-p08372226.html
WOOL BLEND BELTED COAT,59.95 EUR,https://www.zara.com/de/en/wool-blend-belted-coat-p03046341.html
LONG FAUX FUR COAT,99.95 EUR,https://www.zara.com/de/en/long-faux-fur-coat-p06318243.html
DOUBLE-BREASTED COAT WITH POCKETS,59.95 EUR,https://www.zara.com/de/en/double-breasted-coat-with-pockets-p06318238.html
DOUBLE-SIDED REVERSIBLE LONG COAT,89.95 EUR,https://www.zara.com/de/en/double-sided-reversible-long-coat-p06318262.html
WOOL BLEND DOUBLE-BREASTED COAT,99.95 EUR,https://www.zara.com/de/en/wool-blend-double-breasted-coat-p04070223.html
SHORT DOUBLE-BREASTED COAT,49.95 EUR,https://www.zara.com/de/en/short-double-breasted-coat-p08372289.html
SOFT BUTTON COAT,39.95 EUR,https://www.zara.com/de/en/soft-button-coat-p05070660.html
WOOL DOUBLE-BREASTED OVERSIZE COAT,89.95 EUR,https://www.zara.com/de/en/wool-double-breasted-oversize-coat-p08073265.html
WOOL BLEND DOUBLE-BREASTED COAT,79.95 EUR,https://www.zara.com/de/en/wool-blend-double-breasted-coat-p09094141.html
ZW COLLECTION DOUBLE-FACED JACKET,89.95 EUR,https://www.zara.com/de/en/zw-collection-double-faced-jacket-p03548246.html
FAUX LEATHER REVERSIBLE DOUBLE-FACED COAT,79.95 EUR,https://www.zara.com/de/en/faux-leather-reversible-double-faced-coat-p06318248.html
ZW COLLECTION PADDED JACKET,89.95 EUR,https://www.zara.com/de/en/zw-collection-padded-jacket-p00518259.html
MANTECO WOOL BLEND COAT ZW COLLECTION,149.00 EUR,https://www.zara.com/de/en/manteco-wool-blend-coat-zw-collection-p09231756.html
SOFT BUTTON COAT,39.95 EUR,https://www.zara.com/de/en/soft-button-coat-p05070660.html
SHORT DOUBLE-BREASTED COAT,49.95 EUR,https://www.zara.com/de/en/short-double-breasted-coat-p08372289.html
SOFT COAT,59.95 EUR,https://www.zara.com/de/en/soft-coat-p08372304.html
FAUX FUR COAT X STEFANO PILATI,229.00 EUR,https://www.zara.com/de/en/faux-fur-coat-x-stefano-pilati-p06153954.html
FAUX FUR COAT WITH TOGGLES,69.95 EUR,https://www.zara.com/de/en/faux-fur-coat-with-toggles-p08372300.html
LONG WOOL COAT ZW COLLECTION,149.00 EUR,https://www.zara.com/de/en/long-wool-coat-zw-collection-p09266451.html
SOFT BUTTON COAT,39.95 EUR,https://www.zara.com/de/en/soft-button-coat-p05070660.html
LONG CABLE-KNIT COAT,79.95 EUR,https://www.zara.com/de/en/long-cable-knit-coat-p03653109.html
ZW COLLECTION LONG HERRINGBONE COAT,99.95 EUR,https://www.zara.com/de/en/zw-collection-long-herringbone-coat-p03811240.html
ZW COLLECTION DOUBLE-FACED JACKET,89.95 EUR,https://www.zara.com/de/en/zw-collection-double-faced-jacket-p03548248.html
ZW COLLECTION WOOL BLEND COAT,159.00 EUR,https://www.zara.com/de/en/zw-collection-wool-blend-coat-p09573757.html
OVERSIZED DOUBLE-BREASTED COAT,69.95 EUR,https://www.zara.com/de/en/oversized-double-breasted-coat-p08372303.html
LONG FAUX FUR COAT ZW COLLECTION,129.00 EUR,https://www.zara.com/de/en/long-faux-fur-coat-zw-collection-p03833242.html
DOUBLE-FACED COAT ZW COLLECTION,99.95 EUR,https://www.zara.com/de/en/double-faced-coat-zw-collection-p03833244.html
SHORT FAUX FUR COAT,69.95 EUR,https://www.zara.com/de/en/short-faux-fur-coat-p06318021.html
BOUCLÉ COAT WITH MANTECO WOOL ZW COLLECTION,149.00 EUR,https://www.zara.com/de/en/boucle-coat-with-manteco-wool-zw-collection-p09543778.html
ZW COLLECTION FAUX FUR JACKET,99.95 EUR,https://www.zara.com/de/en/zw-collection-faux-fur-jacket-p08490241.html
MANTECO WOOL BLEND OVERSIZE COAT ZW COLLECTION,139.00 EUR,https://www.zara.com/de/en/manteco-wool-blend-oversize-coat-zw-collection-p09149638.html
SOFT BUTTON COAT,39.95 EUR,https://www.zara.com/de/en/soft-button-coat-p05070660.html
CONTRAST COAT WITH DETACHABLE HOOD,69.95 EUR,https://www.zara.com/de/en/contrast-coat-with-detachable-hood-p08073264.html
LIMITED EDITION OVERSIZED LONG COAT,229.00 EUR,https://www.zara.com/de/en/limited-edition-oversized-long-coat-p08517808.html
ZW COLLECTION BELTED WOOL COAT,149.00 EUR,https://www.zara.com/de/en/zw-collection-belted-wool-coat-p03811241.html
ZW COLLECTION FAUX FUR SHORT COAT,119.00 EUR,https://www.zara.com/de/en/zw-collection-faux-fur-short-coat-p03833241.html
DOUBLE-FACED CROPPED 100% LEATHER COAT,579.00 EUR,https://www.zara.com/de/en/double-faced-cropped-100-leather-coat-p01814200.html
ANIMAL PRINT FAUX FUR COAT ZW COLLECTION,179.00 EUR,https://www.zara.com/de/en/animal-print-faux-fur-coat-zw-collection-p02212240.html
FAUX FUR JACKET ZW COLLECTION,79.95 EUR,https://www.zara.com/de/en/faux-fur-jacket-zw-collection-p03833240.html
WOOL BLEND DOUBLE-BREASTED COAT,79.95 EUR,https://www.zara.com/de/en/wool-blend-double-breasted-coat-p09037141.html
WATER RESISTANT COATED JACKET ZW COLLECTION,79.95 EUR,https://www.zara.com/de/en/water-resistant-coated-jacket-zw-collection-p02969259.html
ZW COLLECTION WOOL BLEND SCARF COAT,179.00 EUR,https://www.zara.com/de/en/zw-collection-wool-blend-scarf-coat-p07522244.html
SOFT HOODED BELTED COAT,49.95 EUR,https://www.zara.com/de/en/soft-hooded-belted-coat-p03046328.html
LIMITED EDITION 100% WOOL COAT,279.00 EUR,https://www.zara.com/de/en/limited-edition-100-wool-coat-p03692950.html
SOFT BUTTON COAT,39.95 EUR,https://www.zara.com/de/en/soft-button-coat-p05070660.html
ZW COLLECTION WOOL BLEND BELTED COAT,199.00 EUR,https://www.zara.com/de/en/zw-collection-wool-blend-belted-coat-p07522247.html
LNG CRDGN 14,99.95 EUR,https://www.zara.com/de/en/lng-crdgn-14-p03039307.html
100% WOOL KNIT COAT,119.00 EUR,https://www.zara.com/de/en/100-wool-knit-coat-p04192117.html
WOOL BLEND DOUBLE-BREASTED COAT,79.95 EUR,https://www.zara.com/de/en/wool-blend-double-breasted-coat-p09037141.html
ZW COLLECTION CROPPED WOOL COAT,89.95 EUR,https://www.zara.com/de/en/zw-collection-cropped-wool-coat-p08491243.html
ZW COLLECTION DOUBLE-FACED COAT,89.95 EUR,https://www.zara.com/de/en/zw-collection-double-faced-coat-p03548243.html
LIMITED EDITION DOUBLE-FACED CAPE COAT,229.00 EUR,https://www.zara.com/de/en/limited-edition-double-faced-cape-coat-p03692951.html
WOOL BLEND DOUBLE-BREASTED COAT,79.95 EUR,https://www.zara.com/de/en/wool-blend-double-breasted-coat-p09340141.html
SOFT HOODED BELTED COAT,49.95 EUR,https://www.zara.com/de/en/soft-hooded-belted-coat-p03046328.html
ZW COLLECTION FAUX FUR COAT,149.00 EUR,https://www.zara.com/de/en/zw-collection-faux-fur-coat-p02969255.html
ANIMAL PRINT FAUX FUR COAT,119.00 EUR,https://www.zara.com/de/en/animal-print-faux-fur-coat-p04391772.html
ANIMAL PRINT FAUX FUR COAT,69.95 EUR,https://www.zara.com/de/en/animal-print-faux-fur-coat-p08073270.html
WIDE LAPEL 100% WOOL COAT,119.00 EUR,https://www.zara.com/de/en/wide-lapel-100-wool-coat-p02893172.html
ANIMAL PRINT FAUX FUR COAT,79.95 EUR,https://www.zara.com/de/en/animal-print-faux-fur-coat-p01255771.html
MANTECO WOOL BLEND COAT ZW COLLECTION,119.00 EUR,https://www.zara.com/de/en/manteco-wool-blend-coat-zw-collection-p09356724.html
FAUX FUR COAT WITH JEWEL BEADING,89.95 EUR,https://www.zara.com/de/en/faux-fur-coat-with-jewel-beading-p03920197.html
SHORT FAUX FUR COAT,69.95 EUR,https://www.zara.com/de/en/short-faux-fur-coat-p03920196.html
SOFT LONG COAT,69.95 EUR,https://www.zara.com/de/en/soft-long-coat-p08372302.html
FAUX FUR WAISTCOAT ZW COLLECTION,59.95 EUR,https://www.zara.com/de/en/faux-fur-waistcoat-zw-collection-p08490240.html
ANIMAL PRINT WOOL BLEND COAT ZW COLLECTION,149.00 EUR,https://www.zara.com/de/en/animal-print-wool-blend-coat-zw-collection-p08340701.html
SHORT HERRINGBONE WOOL COAT ZW COLLECTION,89.95 EUR,https://www.zara.com/de/en/short-herringbone-wool-coat-zw-collection-p07522248.html
JEWELLED FAUX FUR COAT ZW COLLECTION,119.00 EUR,https://www.zara.com/de/en/jewelled-faux-fur-coat-zw-collection-p04360248.html
SHORT DOUBLE-BREASTED COAT,49.95 EUR,https://www.zara.com/de/en/short-double-breasted-coat-p08372289.html
COAT,59.95 EUR,https://www.zara.com/de/en/coat-p08741269.html
ASYMMETRIC WOOL BLEND CAPE ZW COLLECTION,119.00 EUR,https://www.zara.com/de/en/asymmetric-wool-blend-cape-zw-collection-p08619451.html
OVERSIZED WOOL BLEND COAT X STEFANO PILATI,219.00 EUR,https://www.zara.com/de/en/oversized-wool-blend-coat-x-stefano-pilati-p09214878.html
ZW COLLECTION BUTTONED COAT,99.95 EUR,https://www.zara.com/de/en/zw-collection-buttoned-coat-p09169707.html
ZW COLLECTION 100% WOOL COAT,199.00 EUR,https://www.zara.com/de/en/zw-collection-100-wool-coat-p08491253.html
ZW COLLECTION KIMONO TRENCH COAT,79.95 EUR,https://www.zara.com/de/en/zw-collection-kimono-trench-coat-p08288022.html
ZW COLLECTION LONG CHECK COAT,179.00 EUR,https://www.zara.com/de/en/zw-collection-long-check-coat-p09492780.html
LONG WOOL FROCK COAT ZW COLLECTION,119.00 EUR,https://www.zara.com/de/en/long-wool-frock-coat-zw-collection-p09260514.html
KNIT JACQUARD COAT,79.95 EUR,https://www.zara.com/de/en/knit-jacquard-coat-p09598106.html
ZW COLLECTION WOOL BLEND COAT WITH BELT,119.00 EUR,https://www.zara.com/de/en/zw-collection-wool-blend-coat-with-belt-p08491246.html
ZW COLLECTION COMBINED WOOL COAT,199.00 EUR,https://www.zara.com/de/en/zw-collection-combined-wool-coat-p09632727.html
ZW COLLECTION 100% WOOL COAT,149.00 EUR,https://www.zara.com/de/en/zw-collection-100-wool-coat-p09285510.html
ANIMAL PRINT FAUX FUR COAT ZW COLLECTION,149.00 EUR,https://www.zara.com/de/en/animal-print-faux-fur-coat-zw-collection-p02212241.html
LONG 100% LEATHER COAT ZW COLLECTION,599.00 EUR,https://www.zara.com/de/en/long-100-leather-coat-zw-collection-p03322246.html
PRK FLD 13,99.95 EUR,https://www.zara.com/de/en/prk-fld-13-p08328251.html
LEATHER COAT WITH CRINKLE EFFECT ZW COLLECTION,299.00 EUR,https://www.zara.com/de/en/leather-coat-with-crinkle-effect-zw-collection-p03436240.html
